t 0 /NodeList/1/$ns3::Ipv4L3Protocol/Tx(1) ns3::Ipv4Header (tos 0x0 DSCP Default ECN Not-ECT ttl 64 id 0 protocol 6 offset (bytes) 0 flags [none] length: 56 10.0.1.1 > 10.0.2.2) ns3::TcpHeader (49153 > 50000 [SYN] Seq=0 Ack=0 Win=65535 ns3::TcpOptionTS(0;0) ns3::TcpOptionWinScale(6) ns3::TcpOptionSackPermitted([sack_perm]) ns3::TcpOptionEnd(EOL))
r 1.00005 /NodeList/0/$ns3::Ipv4L3Protocol/Rx(1) ns3::Ipv4Header (tos 0x0 DSCP Default ECN Not-ECT ttl 64 id 0 protocol 6 offset (bytes) 0 flags [none] length: 56 10.0.1.1 > 10.0.2.2) ns3::TcpHeader (49153 > 50000 [SYN] Seq=0 Ack=0 Win=65535 ns3::TcpOptionTS(0;0) ns3::TcpOptionWinScale(6) ns3::TcpOptionSackPermitted([sack_perm]) ns3::TcpOptionEnd(EOL))
t 1.00005 /NodeList/0/$ns3::Ipv4L3Protocol/Tx(2) ns3::Ipv4Header (tos 0x0 DSCP Default ECN Not-ECT ttl 63 id 0 protocol 6 offset (bytes) 0 flags [none] length: 56 10.0.1.1 > 10.0.2.2) ns3::TcpHeader (49153 > 50000 [SYN] Seq=0 Ack=0 Win=65535 ns3::TcpOptionTS(0;0) ns3::TcpOptionWinScale(6) ns3::TcpOptionSackPermitted([sack_perm]) ns3::TcpOptionEnd(EOL))
r 2.00028 /NodeList/2/$ns3::Ipv4L3Protocol/Rx(1) ns3::Ipv4Header (tos 0x0 DSCP Default ECN Not-ECT ttl 63 id 0 protocol 6 offset (bytes) 0 flags [none] length: 56 10.0.1.1 > 10.0.2.2) ns3::TcpHeader (49153 > 50000 [SYN] Seq=0 Ack=0 Win=65535 ns3::TcpOptionTS(0;0) ns3::TcpOptionWinScale(6) ns3::TcpOptionSackPermitted([sack_perm]) ns3::TcpOptionEnd(EOL))
t 2.00028 /NodeList/2/$ns3::Ipv4L3Protocol/Tx(1) ns3::Ipv4Header (tos 0x0 DSCP Default ECN Not-ECT ttl 64 id 0 protocol 6 offset (bytes) 0 flags [none] length: 56 10.0.2.2 > 10.0.1.1) ns3::TcpHeader (50000 > 49153 [SYN|ACK] Seq=0 Ack=1 Win=65535 ns3::TcpOptionTS(2000;0) ns3::TcpOptionWinScale(6) ns3::TcpOptionSackPermitted([sack_perm]) ns3::TcpOptionEnd(EOL))
t 3 /NodeList/1/$ns3::Ipv4L3Protocol/Tx(1) ns3::Ipv4Header (tos 0x0 DSCP Default ECN Not-ECT ttl 64 id 1 protocol 6 offset (bytes) 0 flags [none] length: 56 10.0.1.1 > 10.0.2.2) ns3::TcpHeader (49153 > 50000 [SYN] Seq=0 Ack=0 Win=65535 ns3::TcpOptionTS(3000;0) ns3::TcpOptionWinScale(6) ns3::TcpOptionSackPermitted([sack_perm]) ns3::TcpOptionEnd(EOL))
r 3.00051 /NodeList/0/$ns3::Ipv4L3Protocol/Rx(2) ns3::Ipv4Header (tos 0x0 DSCP Default ECN Not-ECT ttl 64 id 0 protocol 6 offset (bytes) 0 flags [none] length: 56 10.0.2.2 > 10.0.1.1) ns3::TcpHeader (50000 > 49153 [SYN|ACK] Seq=0 Ack=1 Win=65535 ns3::TcpOptionTS(2000;0) ns3::TcpOptionWinScale(6) ns3::TcpOptionSackPermitted([sack_perm]) ns3::TcpOptionEnd(EOL))
t 3.00051 /NodeList/0/$ns3::Ipv4L3Protocol/Tx(1) ns3::Ipv4Header (tos 0x0 DSCP Default ECN Not-ECT ttl 63 id 0 protocol 6 offset (bytes) 0 flags [none] length: 56 10.0.2.2 > 10.0.1.1) ns3::TcpHeader (50000 > 49153 [SYN|ACK] Seq=0 Ack=1 Win=65535 ns3::TcpOptionTS(2000;0) ns3::TcpOptionWinScale(6) ns3::TcpOptionSackPermitted([sack_perm]) ns3::TcpOptionEnd(EOL))
r 4.00005 /NodeList/0/$ns3::Ipv4L3Protocol/Rx(1) ns3::Ipv4Header (tos 0x0 DSCP Default ECN Not-ECT ttl 64 id 1 protocol 6 offset (bytes) 0 flags [none] length: 56 10.0.1.1 > 10.0.2.2) ns3::TcpHeader (49153 > 50000 [SYN] Seq=0 Ack=0 Win=65535 ns3::TcpOptionTS(3000;0) ns3::TcpOptionWinScale(6) ns3::TcpOptionSackPermitted([sack_perm]) ns3::TcpOptionEnd(EOL))
t 4.00005 /NodeList/0/$ns3::Ipv4L3Protocol/Tx(2) ns3::Ipv4Header (tos 0x0 DSCP Default ECN Not-ECT ttl 63 id 1 protocol 6 offset (bytes) 0 flags [none] length: 56 10.0.1.1 > 10.0.2.2) ns3::TcpHeader (49153 > 50000 [SYN] Seq=0 Ack=0 Win=65535 ns3::TcpOptionTS(3000;0) ns3::TcpOptionWinScale(6) ns3::TcpOptionSackPermitted([sack_perm]) ns3::TcpOptionEnd(EOL))
r 4.00056 /NodeList/1/$ns3::Ipv4L3Protocol/Rx(1) ns3::Ipv4Header (tos 0x0 DSCP Default ECN Not-ECT ttl 63 id 0 protocol 6 offset (bytes) 0 flags [none] length: 56 10.0.2.2 > 10.0.1.1) ns3::TcpHeader (50000 > 49153 [SYN|ACK] Seq=0 Ack=1 Win=65535 ns3::TcpOptionTS(2000;0) ns3::TcpOptionWinScale(6) ns3::TcpOptionSackPermitted([sack_perm]) ns3::TcpOptionEnd(EOL))
t 4.00056 /NodeList/1/$ns3::Ipv4L3Protocol/Tx(1) ns3::Ipv4Header (tos 0x0 DSCP Default ECN Not-ECT ttl 64 id 2 protocol 6 offset (bytes) 0 flags [none] length: 52 10.0.1.1 > 10.0.2.2) ns3::TcpHeader (49153 > 50000 [ACK] Seq=1 Ack=1 Win=32768 ns3::TcpOptionTS(4000;2000) ns3::TcpOptionEnd(EOL))
t 4.00056 /NodeList/1/$ns3::Ipv4L3Protocol/Tx(1) ns3::Ipv4Header (tos 0x0 DSCP Default ECN Not-ECT ttl 64 id 3 protocol 6 offset (bytes) 0 flags [none] length: 392 10.0.1.1 > 10.0.2.2) ns3::TcpHeader (49153 > 50000 [ACK] Seq=1 Ack=1 Win=32768 ns3::TcpOptionTS(4000;2000) ns3::TcpOptionEnd(EOL)) Payload (size=340)
t 5.00028 /NodeList/2/$ns3::Ipv4L3Protocol/Tx(1) ns3::Ipv4Header (tos 0x0 DSCP Default ECN Not-ECT ttl 64 id 1 protocol 6 offset (bytes) 0 flags [none] length: 56 10.0.2.2 > 10.0.1.1) ns3::TcpHeader (50000 > 49153 [SYN|ACK] Seq=0 Ack=1 Win=65535 ns3::TcpOptionTS(5000;0) ns3::TcpOptionWinScale(6) ns3::TcpOptionSackPermitted([sack_perm]) ns3::TcpOptionEnd(EOL))
r 5.00028 /NodeList/2/$ns3::Ipv4L3Protocol/Rx(1) ns3::Ipv4Header (tos 0x0 DSCP Default ECN Not-ECT ttl 63 id 1 protocol 6 offset (bytes) 0 flags [none] length: 56 10.0.1.1 > 10.0.2.2) ns3::TcpHeader (49153 > 50000 [SYN] Seq=0 Ack=0 Win=65535 ns3::TcpOptionTS(3000;0) ns3::TcpOptionWinScale(6) ns3::TcpOptionSackPermitted([sack_perm]) ns3::TcpOptionEnd(EOL))
t 5.00028 /NodeList/2/$ns3::Ipv4L3Protocol/Tx(1) ns3::Ipv4Header (tos 0x0 DSCP Default ECN Not-ECT ttl 64 id 2 protocol 6 offset (bytes) 0 flags [none] length: 56 10.0.2.2 > 10.0.1.1) ns3::TcpHeader (50000 > 49153 [SYN|ACK] Seq=0 Ack=1 Win=65535 ns3::TcpOptionTS(5000;0) ns3::TcpOptionWinScale(6) ns3::TcpOptionSackPermitted([sack_perm]) ns3::TcpOptionEnd(EOL))
r 5.0006 /NodeList/0/$ns3::Ipv4L3Protocol/Rx(1) ns3::Ipv4Header (tos 0x0 DSCP Default ECN Not-ECT ttl 64 id 2 protocol 6 offset (bytes) 0 flags [none] length: 52 10.0.1.1 > 10.0.2.2) ns3::TcpHeader (49153 > 50000 [ACK] Seq=1 Ack=1 Win=32768 ns3::TcpOptionTS(4000;2000) ns3::TcpOptionEnd(EOL))
t 5.0006 /NodeList/0/$ns3::Ipv4L3Protocol/Tx(2) ns3::Ipv4Header (tos 0x0 DSCP Default ECN Not-ECT ttl 63 id 2 protocol 6 offset (bytes) 0 flags [none] length: 52 10.0.1.1 > 10.0.2.2) ns3::TcpHeader (49153 > 50000 [ACK] Seq=1 Ack=1 Win=32768 ns3::TcpOptionTS(4000;2000) ns3::TcpOptionEnd(EOL))
r 5.00092 /NodeList/0/$ns3::Ipv4L3Protocol/Rx(1) ns3::Ipv4Header (tos 0x0 DSCP Default ECN Not-ECT ttl 64 id 3 protocol 6 offset (bytes) 0 flags [none] length: 392 10.0.1.1 > 10.0.2.2) ns3::TcpHeader (49153 > 50000 [ACK] Seq=1 Ack=1 Win=32768 ns3::TcpOptionTS(4000;2000) ns3::TcpOptionEnd(EOL)) Payload (size=340)
t 5.00092 /NodeList/0/$ns3::Ipv4L3Protocol/Tx(2) ns3::Ipv4Header (tos 0x0 DSCP Default ECN Not-ECT ttl 63 id 3 protocol 6 offset (bytes) 0 flags [none] length: 392 10.0.1.1 > 10.0.2.2) ns3::TcpHeader (49153 > 50000 [ACK] Seq=1 Ack=1 Win=32768 ns3::TcpOptionTS(4000;2000) ns3::TcpOptionEnd(EOL)) Payload (size=340)
r 6.00051 /NodeList/0/$ns3::Ipv4L3Protocol/Rx(2) ns3::Ipv4Header (tos 0x0 DSCP Default ECN Not-ECT ttl 64 id 1 protocol 6 offset (bytes) 0 flags [none] length: 56 10.0.2.2 > 10.0.1.1) ns3::TcpHeader (50000 > 49153 [SYN|ACK] Seq=0 Ack=1 Win=65535 ns3::TcpOptionTS(5000;0) ns3::TcpOptionWinScale(6) ns3::TcpOptionSackPermitted([sack_perm]) ns3::TcpOptionEnd(EOL))
t 6.00051 /NodeList/0/$ns3::Ipv4L3Protocol/Tx(1) ns3::Ipv4Header (tos 0x0 DSCP Default ECN Not-ECT ttl 63 id 1 protocol 6 offset (bytes) 0 flags [none] length: 56 10.0.2.2 > 10.0.1.1) ns3::TcpHeader (50000 > 49153 [SYN|ACK] Seq=0 Ack=1 Win=65535 ns3::TcpOptionTS(5000;0) ns3::TcpOptionWinScale(6) ns3::TcpOptionSackPermitted([sack_perm]) ns3::TcpOptionEnd(EOL))
r 6.00074 /NodeList/0/$ns3::Ipv4L3Protocol/Rx(2) ns3::Ipv4Header (tos 0x0 DSCP Default ECN Not-ECT ttl 64 id 2 protocol 6 offset (bytes) 0 flags [none] length: 56 10.0.2.2 > 10.0.1.1) ns3::TcpHeader (50000 > 49153 [SYN|ACK] Seq=0 Ack=1 Win=65535 ns3::TcpOptionTS(5000;0) ns3::TcpOptionWinScale(6) ns3::TcpOptionSackPermitted([sack_perm]) ns3::TcpOptionEnd(EOL))
t 6.00074 /NodeList/0/$ns3::Ipv4L3Protocol/Tx(1) ns3::Ipv4Header (tos 0x0 DSCP Default ECN Not-ECT ttl 63 id 2 protocol 6 offset (bytes) 0 flags [none] length: 56 10.0.2.2 > 10.0.1.1) ns3::TcpHeader (50000 > 49153 [SYN|ACK] Seq=0 Ack=1 Win=65535 ns3::TcpOptionTS(5000;0) ns3::TcpOptionWinScale(6) ns3::TcpOptionSackPermitted([sack_perm]) ns3::TcpOptionEnd(EOL))
r 6.00082 /NodeList/2/$ns3::Ipv4L3Protocol/Rx(1) ns3::Ipv4Header (tos 0x0 DSCP Default ECN Not-ECT ttl 63 id 2 protocol 6 offset (bytes) 0 flags [none] length: 52 10.0.1.1 > 10.0.2.2) ns3::TcpHeader (49153 > 50000 [ACK] Seq=1 Ack=1 Win=32768 ns3::TcpOptionTS(4000;2000) ns3::TcpOptionEnd(EOL))
r 6.00249 /NodeList/2/$ns3::Ipv4L3Protocol/Rx(1) ns3::Ipv4Header (tos 0x0 DSCP Default ECN Not-ECT ttl 63 id 3 protocol 6 offset (bytes) 0 flags [none] length: 392 10.0.1.1 > 10.0.2.2) ns3::TcpHeader (49153 > 50000 [ACK] Seq=1 Ack=1 Win=32768 ns3::TcpOptionTS(4000;2000) ns3::TcpOptionEnd(EOL)) Payload (size=340)
t 6.00249 /NodeList/2/$ns3::Ipv4L3Protocol/Tx(1) ns3::Ipv4Header (tos 0x0 DSCP Default ECN Not-ECT ttl 64 id 3 protocol 6 offset (bytes) 0 flags [none] length: 52 10.0.2.2 > 10.0.1.1) ns3::TcpHeader (50000 > 49153 [ACK] Seq=1 Ack=341 Win=32768 ns3::TcpOptionTS(6002;4000) ns3::TcpOptionEnd(EOL))
r 7.00056 /NodeList/1/$ns3::Ipv4L3Protocol/Rx(1) ns3::Ipv4Header (tos 0x0 DSCP Default ECN Not-ECT ttl 63 id 1 protocol 6 offset (bytes) 0 flags [none] length: 56 10.0.2.2 > 10.0.1.1) ns3::TcpHeader (50000 > 49153 [SYN|ACK] Seq=0 Ack=1 Win=65535 ns3::TcpOptionTS(5000;0) ns3::TcpOptionWinScale(6) ns3::TcpOptionSackPermitted([sack_perm]) ns3::TcpOptionEnd(EOL))
r 7.00079 /NodeList/1/$ns3::Ipv4L3Protocol/Rx(1) ns3::Ipv4Header (tos 0x0 DSCP Default ECN Not-ECT ttl 63 id 2 protocol 6 offset (bytes) 0 flags [none] length: 56 10.0.2.2 > 10.0.1.1) ns3::TcpHeader (50000 > 49153 [SYN|ACK] Seq=0 Ack=1 Win=65535 ns3::TcpOptionTS(5000;0) ns3::TcpOptionWinScale(6) ns3::TcpOptionSackPermitted([sack_perm]) ns3::TcpOptionEnd(EOL))
r 7.00271 /NodeList/0/$ns3::Ipv4L3Protocol/Rx(2) ns3::Ipv4Header (tos 0x0 DSCP Default ECN Not-ECT ttl 64 id 3 protocol 6 offset (bytes) 0 flags [none] length: 52 10.0.2.2 > 10.0.1.1) ns3::TcpHeader (50000 > 49153 [ACK] Seq=1 Ack=341 Win=32768 ns3::TcpOptionTS(6002;4000) ns3::TcpOptionEnd(EOL))
t 7.00271 /NodeList/0/$ns3::Ipv4L3Protocol/Tx(1) ns3::Ipv4Header (tos 0x0 DSCP Default ECN Not-ECT ttl 63 id 3 protocol 6 offset (bytes) 0 flags [none] length: 52 10.0.2.2 > 10.0.1.1) ns3::TcpHeader (50000 > 49153 [ACK] Seq=1 Ack=341 Win=32768 ns3::TcpOptionTS(6002;4000) ns3::TcpOptionEnd(EOL))
r 8.00275 /NodeList/1/$ns3::Ipv4L3Protocol/Rx(1) ns3::Ipv4Header (tos 0x0 DSCP Default ECN Not-ECT ttl 63 id 3 protocol 6 offset (bytes) 0 flags [none] length: 52 10.0.2.2 > 10.0.1.1) ns3::TcpHeader (50000 > 49153 [ACK] Seq=1 Ack=341 Win=32768 ns3::TcpOptionTS(6002;4000) ns3::TcpOptionEnd(EOL))
t 8.00275 /NodeList/1/$ns3::Ipv4L3Protocol/Tx(1) ns3::Ipv4Header (tos 0x0 DSCP Default ECN Not-ECT ttl 64 id 4 protocol 6 offset (bytes) 0 flags [none] length: 392 10.0.1.1 > 10.0.2.2) ns3::TcpHeader (49153 > 50000 [ACK] Seq=341 Ack=1 Win=32768 ns3::TcpOptionTS(8002;6002) ns3::TcpOptionEnd(EOL)) Payload (size=340)
t 8.00275 /NodeList/1/$ns3::Ipv4L3Protocol/Tx(1) ns3::Ipv4Header (tos 0x0 DSCP Default ECN Not-ECT ttl 64 id 5 protocol 6 offset (bytes) 0 flags [none] length: 392 10.0.1.1 > 10.0.2.2) ns3::TcpHeader (49153 > 50000 [ACK] Seq=681 Ack=1 Win=32768 ns3::TcpOptionTS(8002;6002) ns3::TcpOptionEnd(EOL)) Payload (size=340)
r 9.00307 /NodeList/0/$ns3::Ipv4L3Protocol/Rx(1) ns3::Ipv4Header (tos 0x0 DSCP Default ECN Not-ECT ttl 64 id 4 protocol 6 offset (bytes) 0 flags [none] length: 392 10.0.1.1 > 10.0.2.2) ns3::TcpHeader (49153 > 50000 [ACK] Seq=341 Ack=1 Win=32768 ns3::TcpOptionTS(8002;6002) ns3::TcpOptionEnd(EOL)) Payload (size=340)
t 9.00307 /NodeList/0/$ns3::Ipv4L3Protocol/Tx(2) ns3::Ipv4Header (tos 0x0 DSCP Default ECN Not-ECT ttl 63 id 4 protocol 6 offset (bytes) 0 flags [none] length: 392 10.0.1.1 > 10.0.2.2) ns3::TcpHeader (49153 > 50000 [ACK] Seq=341 Ack=1 Win=32768 ns3::TcpOptionTS(8002;6002) ns3::TcpOptionEnd(EOL)) Payload (size=340)
r 9.00338 /NodeList/0/$ns3::Ipv4L3Protocol/Rx(1) ns3::Ipv4Header (tos 0x0 DSCP Default ECN Not-ECT ttl 64 id 5 protocol 6 offset (bytes) 0 flags [none] length: 392 10.0.1.1 > 10.0.2.2) ns3::TcpHeader (49153 > 50000 [ACK] Seq=681 Ack=1 Win=32768 ns3::TcpOptionTS(8002;6002) ns3::TcpOptionEnd(EOL)) Payload (size=340)
t 9.00338 /NodeList/0/$ns3::Ipv4L3Protocol/Tx(2) ns3::Ipv4Header (tos 0x0 DSCP Default ECN Not-ECT ttl 63 id 5 protocol 6 offset (bytes) 0 flags [none] length: 392 10.0.1.1 > 10.0.2.2) ns3::TcpHeader (49153 > 50000 [ACK] Seq=681 Ack=1 Win=32768 ns3::TcpOptionTS(8002;6002) ns3::TcpOptionEnd(EOL)) Payload (size=340)
r 10.0046 /NodeList/2/$ns3::Ipv4L3Protocol/Rx(1) ns3::Ipv4Header (tos 0x0 DSCP Default ECN Not-ECT ttl 63 id 4 protocol 6 offset (bytes) 0 flags [none] length: 392 10.0.1.1 > 10.0.2.2) ns3::TcpHeader (49153 > 50000 [ACK] Seq=341 Ack=1 Win=32768 ns3::TcpOptionTS(8002;6002) ns3::TcpOptionEnd(EOL)) Payload (size=340)
r 10.0062 /NodeList/2/$ns3::Ipv4L3Protocol/Rx(1) ns3::Ipv4Header (tos 0x0 DSCP Default ECN Not-ECT ttl 63 id 5 protocol 6 offset (bytes) 0 flags [none] length: 392 10.0.1.1 > 10.0.2.2) ns3::TcpHeader (49153 > 50000 [ACK] Seq=681 Ack=1 Win=32768 ns3::TcpOptionTS(8002;6002) ns3::TcpOptionEnd(EOL)) Payload (size=340)
t 10.0062 /NodeList/2/$ns3::Ipv4L3Protocol/Tx(1) ns3::Ipv4Header (tos 0x0 DSCP Default ECN Not-ECT ttl 64 id 4 protocol 6 offset (bytes) 0 flags [none] length: 52 10.0.2.2 > 10.0.1.1) ns3::TcpHeader (50000 > 49153 [ACK] Seq=1 Ack=1021 Win=32768 ns3::TcpOptionTS(10006;8002) ns3::TcpOptionEnd(EOL))
r 11.0064 /NodeList/0/$ns3::Ipv4L3Protocol/Rx(2) ns3::Ipv4Header (tos 0x0 DSCP Default ECN Not-ECT ttl 64 id 4 protocol 6 offset (bytes) 0 flags [none] length: 52 10.0.2.2 > 10.0.1.1) ns3::TcpHeader (50000 > 49153 [ACK] Seq=1 Ack=1021 Win=32768 ns3::TcpOptionTS(10006;8002) ns3::TcpOptionEnd(EOL))
t 11.0064 /NodeList/0/$ns3::Ipv4L3Protocol/Tx(1) ns3::Ipv4Header (tos 0x0 DSCP Default ECN Not-ECT ttl 63 id 4 protocol 6 offset (bytes) 0 flags [none] length: 52 10.0.2.2 > 10.0.1.1) ns3::TcpHeader (50000 > 49153 [ACK] Seq=1 Ack=1021 Win=32768 ns3::TcpOptionTS(10006;8002) ns3::TcpOptionEnd(EOL))
r 12.0065 /NodeList/1/$ns3::Ipv4L3Protocol/Rx(1) ns3::Ipv4Header (tos 0x0 DSCP Default ECN Not-ECT ttl 63 id 4 protocol 6 offset (bytes) 0 flags [none] length: 52 10.0.2.2 > 10.0.1.1) ns3::TcpHeader (50000 > 49153 [ACK] Seq=1 Ack=1021 Win=32768 ns3::TcpOptionTS(10006;8002) ns3::TcpOptionEnd(EOL))
t 12.0065 /NodeList/1/$ns3::Ipv4L3Protocol/Tx(1) ns3::Ipv4Header (tos 0x0 DSCP Default ECN Not-ECT ttl 64 id 6 protocol 6 offset (bytes) 0 flags [none] length: 392 10.0.1.1 > 10.0.2.2) ns3::TcpHeader (49153 > 50000 [ACK] Seq=1021 Ack=1 Win=32768 ns3::TcpOptionTS(12006;10006) ns3::TcpOptionEnd(EOL)) Payload (size=340)
t 12.0065 /NodeList/1/$ns3::Ipv4L3Protocol/Tx(1) ns3::Ipv4Header (tos 0x0 DSCP Default ECN Not-ECT ttl 64 id 7 protocol 6 offset (bytes) 0 flags [none] length: 392 10.0.1.1 > 10.0.2.2) ns3::TcpHeader (49153 > 50000 [ACK] Seq=1361 Ack=1 Win=32768 ns3::TcpOptionTS(12006;10006) ns3::TcpOptionEnd(EOL)) Payload (size=340)
t 12.0065 /NodeList/1/$ns3::Ipv4L3Protocol/Tx(1) ns3::Ipv4Header (tos 0x0 DSCP Default ECN Not-ECT ttl 64 id 8 protocol 6 offset (bytes) 0 flags [none] length: 392 10.0.1.1 > 10.0.2.2) ns3::TcpHeader (49153 > 50000 [ACK] Seq=1701 Ack=1 Win=32768 ns3::TcpOptionTS(12006;10006) ns3::TcpOptionEnd(EOL)) Payload (size=340)
r 13.0068 /NodeList/0/$ns3::Ipv4L3Protocol/Rx(1) ns3::Ipv4Header (tos 0x0 DSCP Default ECN Not-ECT ttl 64 id 6 protocol 6 offset (bytes) 0 flags [none] length: 392 10.0.1.1 > 10.0.2.2) ns3::TcpHeader (49153 > 50000 [ACK] Seq=1021 Ack=1 Win=32768 ns3::TcpOptionTS(12006;10006) ns3::TcpOptionEnd(EOL)) Payload (size=340)
t 13.0068 /NodeList/0/$ns3::Ipv4L3Protocol/Tx(2) ns3::Ipv4Header (tos 0x0 DSCP Default ECN Not-ECT ttl 63 id 6 protocol 6 offset (bytes) 0 flags [none] length: 392 10.0.1.1 > 10.0.2.2) ns3::TcpHeader (49153 > 50000 [ACK] Seq=1021 Ack=1 Win=32768 ns3::TcpOptionTS(12006;10006) ns3::TcpOptionEnd(EOL)) Payload (size=340)
r 13.0071 /NodeList/0/$ns3::Ipv4L3Protocol/Rx(1) ns3::Ipv4Header (tos 0x0 DSCP Default ECN Not-ECT ttl 64 id 7 protocol 6 offset (bytes) 0 flags [none] length: 392 10.0.1.1 > 10.0.2.2) ns3::TcpHeader (49153 > 50000 [ACK] Seq=1361 Ack=1 Win=32768 ns3::TcpOptionTS(12006;10006) ns3::TcpOptionEnd(EOL)) Payload (size=340)
t 13.0071 /NodeList/0/$ns3::Ipv4L3Protocol/Tx(2) ns3::Ipv4Header (tos 0x0 DSCP Default ECN Not-ECT ttl 63 id 7 protocol 6 offset (bytes) 0 flags [none] length: 392 10.0.1.1 > 10.0.2.2) ns3::TcpHeader (49153 > 50000 [ACK] Seq=1361 Ack=1 Win=32768 ns3::TcpOptionTS(12006;10006) ns3::TcpOptionEnd(EOL)) Payload (size=340)
r 13.0074 /NodeList/0/$ns3::Ipv4L3Protocol/Rx(1) ns3::Ipv4Header (tos 0x0 DSCP Default ECN Not-ECT ttl 64 id 8 protocol 6 offset (bytes) 0 flags [none] length: 392 10.0.1.1 > 10.0.2.2) ns3::TcpHeader (49153 > 50000 [ACK] Seq=1701 Ack=1 Win=32768 ns3::TcpOptionTS(12006;10006) ns3::TcpOptionEnd(EOL)) Payload (size=340)
t 13.0074 /NodeList/0/$ns3::Ipv4L3Protocol/Tx(2) ns3::Ipv4Header (tos 0x0 DSCP Default ECN Not-ECT ttl 63 id 8 protocol 6 offset (bytes) 0 flags [none] length: 392 10.0.1.1 > 10.0.2.2) ns3::TcpHeader (49153 > 50000 [ACK] Seq=1701 Ack=1 Win=32768 ns3::TcpOptionTS(12006;10006) ns3::TcpOptionEnd(EOL)) Payload (size=340)
r 14.0084 /NodeList/2/$ns3::Ipv4L3Protocol/Rx(1) ns3::Ipv4Header (tos 0x0 DSCP Default ECN Not-ECT ttl 63 id 6 protocol 6 offset (bytes) 0 flags [none] length: 392 10.0.1.1 > 10.0.2.2) ns3::TcpHeader (49153 > 50000 [ACK] Seq=1021 Ack=1 Win=32768 ns3::TcpOptionTS(12006;10006) ns3::TcpOptionEnd(EOL)) Payload (size=340)
r 14.0099 /NodeList/2/$ns3::Ipv4L3Protocol/Rx(1) ns3::Ipv4Header (tos 0x0 DSCP Default ECN Not-ECT ttl 63 id 7 protocol 6 offset (bytes) 0 flags [none] length: 392 10.0.1.1 > 10.0.2.2) ns3::TcpHeader (49153 > 50000 [ACK] Seq=1361 Ack=1 Win=32768 ns3::TcpOptionTS(12006;10006) ns3::TcpOptionEnd(EOL)) Payload (size=340)
t 14.0099 /NodeList/2/$ns3::Ipv4L3Protocol/Tx(1) ns3::Ipv4Header (tos 0x0 DSCP Default ECN Not-ECT ttl 64 id 5 protocol 6 offset (bytes) 0 flags [none] length: 52 10.0.2.2 > 10.0.1.1) ns3::TcpHeader (50000 > 49153 [ACK] Seq=1 Ack=1701 Win=32768 ns3::TcpOptionTS(14009;12006) ns3::TcpOptionEnd(EOL))
r 14.0115 /NodeList/2/$ns3::Ipv4L3Protocol/Rx(1) ns3::Ipv4Header (tos 0x0 DSCP Default ECN Not-ECT ttl 63 id 8 protocol 6 offset (bytes) 0 flags [none] length: 392 10.0.1.1 > 10.0.2.2) ns3::TcpHeader (49153 > 50000 [ACK] Seq=1701 Ack=1 Win=32768 ns3::TcpOptionTS(12006;10006) ns3::TcpOptionEnd(EOL)) Payload (size=340)
t 14.2115 /NodeList/2/$ns3::Ipv4L3Protocol/Tx(1) ns3::Ipv4Header (tos 0x0 DSCP Default ECN Not-ECT ttl 64 id 6 protocol 6 offset (bytes) 0 flags [none] length: 52 10.0.2.2 > 10.0.1.1) ns3::TcpHeader (50000 > 49153 [ACK] Seq=1 Ack=2041 Win=32768 ns3::TcpOptionTS(14211;12006) ns3::TcpOptionEnd(EOL))
r 15.0102 /NodeList/0/$ns3::Ipv4L3Protocol/Rx(2) ns3::Ipv4Header (tos 0x0 DSCP Default ECN Not-ECT ttl 64 id 5 protocol 6 offset (bytes) 0 flags [none] length: 52 10.0.2.2 > 10.0.1.1) ns3::TcpHeader (50000 > 49153 [ACK] Seq=1 Ack=1701 Win=32768 ns3::TcpOptionTS(14009;12006) ns3::TcpOptionEnd(EOL))
t 15.0102 /NodeList/0/$ns3::Ipv4L3Protocol/Tx(1) ns3::Ipv4Header (tos 0x0 DSCP Default ECN Not-ECT ttl 63 id 5 protocol 6 offset (bytes) 0 flags [none] length: 52 10.0.2.2 > 10.0.1.1) ns3::TcpHeader (50000 > 49153 [ACK] Seq=1 Ack=1701 Win=32768 ns3::TcpOptionTS(14009;12006) ns3::TcpOptionEnd(EOL))
r 15.2117 /NodeList/0/$ns3::Ipv4L3Protocol/Rx(2) ns3::Ipv4Header (tos 0x0 DSCP Default ECN Not-ECT ttl 64 id 6 protocol 6 offset (bytes) 0 flags [none] length: 52 10.0.2.2 > 10.0.1.1) ns3::TcpHeader (50000 > 49153 [ACK] Seq=1 Ack=2041 Win=32768 ns3::TcpOptionTS(14211;12006) ns3::TcpOptionEnd(EOL))
t 15.2117 /NodeList/0/$ns3::Ipv4L3Protocol/Tx(1) ns3::Ipv4Header (tos 0x0 DSCP Default ECN Not-ECT ttl 63 id 6 protocol 6 offset (bytes) 0 flags [none] length: 52 10.0.2.2 > 10.0.1.1) ns3::TcpHeader (50000 > 49153 [ACK] Seq=1 Ack=2041 Win=32768 ns3::TcpOptionTS(14211;12006) ns3::TcpOptionEnd(EOL))
r 16.0102 /NodeList/1/$ns3::Ipv4L3Protocol/Rx(1) ns3::Ipv4Header (tos 0x0 DSCP Default ECN Not-ECT ttl 63 id 5 protocol 6 offset (bytes) 0 flags [none] length: 52 10.0.2.2 > 10.0.1.1) ns3::TcpHeader (50000 > 49153 [ACK] Seq=1 Ack=1701 Win=32768 ns3::TcpOptionTS(14009;12006) ns3::TcpOptionEnd(EOL))
t 16.0102 /NodeList/1/$ns3::Ipv4L3Protocol/Tx(1) ns3::Ipv4Header (tos 0x0 DSCP Default ECN Not-ECT ttl 64 id 9 protocol 6 offset (bytes) 0 flags [none] length: 392 10.0.1.1 > 10.0.2.2) ns3::TcpHeader (49153 > 50000 [ACK] Seq=2041 Ack=1 Win=32768 ns3::TcpOptionTS(16010;14009) ns3::TcpOptionEnd(EOL)) Payload (size=340)
t 16.0102 /NodeList/1/$ns3::Ipv4L3Protocol/Tx(1) ns3::Ipv4Header (tos 0x0 DSCP Default ECN Not-ECT ttl 64 id 10 protocol 6 offset (bytes) 0 flags [none] length: 392 10.0.1.1 > 10.0.2.2) ns3::TcpHeader (49153 > 50000 [ACK] Seq=2381 Ack=1 Win=32768 ns3::TcpOptionTS(16010;14009) ns3::TcpOptionEnd(EOL)) Payload (size=340)
t 16.0102 /NodeList/1/$ns3::Ipv4L3Protocol/Tx(1) ns3::Ipv4Header (tos 0x0 DSCP Default ECN Not-ECT ttl 64 id 11 protocol 6 offset (bytes) 0 flags [none] length: 392 10.0.1.1 > 10.0.2.2) ns3::TcpHeader (49153 > 50000 [ACK] Seq=2721 Ack=1 Win=32768 ns3::TcpOptionTS(16010;14009) ns3::TcpOptionEnd(EOL)) Payload (size=340)
r 16.2118 /NodeList/1/$ns3::Ipv4L3Protocol/Rx(1) ns3::Ipv4Header (tos 0x0 DSCP Default ECN Not-ECT ttl 63 id 6 protocol 6 offset (bytes) 0 flags [none] length: 52 10.0.2.2 > 10.0.1.1) ns3::TcpHeader (50000 > 49153 [ACK] Seq=1 Ack=2041 Win=32768 ns3::TcpOptionTS(14211;12006) ns3::TcpOptionEnd(EOL))
t 16.2118 /NodeList/1/$ns3::Ipv4L3Protocol/Tx(1) ns3::Ipv4Header (tos 0x0 DSCP Default ECN Not-ECT ttl 64 id 12 protocol 6 offset (bytes) 0 flags [none] length: 392 10.0.1.1 > 10.0.2.2) ns3::TcpHeader (49153 > 50000 [ACK] Seq=3061 Ack=1 Win=32768 ns3::TcpOptionTS(16211;14211) ns3::TcpOptionEnd(EOL)) Payload (size=340)
t 16.2118 /NodeList/1/$ns3::Ipv4L3Protocol/Tx(1) ns3::Ipv4Header (tos 0x0 DSCP Default ECN Not-ECT ttl 64 id 13 protocol 6 offset (bytes) 0 flags [none] length: 392 10.0.1.1 > 10.0.2.2) ns3::TcpHeader (49153 > 50000 [ACK] Seq=3401 Ack=1 Win=32768 ns3::TcpOptionTS(16211;14211) ns3::TcpOptionEnd(EOL)) Payload (size=340)
r 17.0105 /NodeList/0/$ns3::Ipv4L3Protocol/Rx(1) ns3::Ipv4Header (tos 0x0 DSCP Default ECN Not-ECT ttl 64 id 9 protocol 6 offset (bytes) 0 flags [none] length: 392 10.0.1.1 > 10.0.2.2) ns3::TcpHeader (49153 > 50000 [ACK] Seq=2041 Ack=1 Win=32768 ns3::TcpOptionTS(16010;14009) ns3::TcpOptionEnd(EOL)) Payload (size=340)
t 17.0105 /NodeList/0/$ns3::Ipv4L3Protocol/Tx(2) ns3::Ipv4Header (tos 0x0 DSCP Default ECN Not-ECT ttl 63 id 9 protocol 6 offset (bytes) 0 flags [none] length: 392 10.0.1.1 > 10.0.2.2) ns3::TcpHeader (49153 > 50000 [ACK] Seq=2041 Ack=1 Win=32768 ns3::TcpOptionTS(16010;14009) ns3::TcpOptionEnd(EOL)) Payload (size=340)
r 17.0108 /NodeList/0/$ns3::Ipv4L3Protocol/Rx(1) ns3::Ipv4Header (tos 0x0 DSCP Default ECN Not-ECT ttl 64 id 10 protocol 6 offset (bytes) 0 flags [none] length: 392 10.0.1.1 > 10.0.2.2) ns3::TcpHeader (49153 > 50000 [ACK] Seq=2381 Ack=1 Win=32768 ns3::TcpOptionTS(16010;14009) ns3::TcpOptionEnd(EOL)) Payload (size=340)
t 17.0108 /NodeList/0/$ns3::Ipv4L3Protocol/Tx(2) ns3::Ipv4Header (tos 0x0 DSCP Default ECN Not-ECT ttl 63 id 10 protocol 6 offset (bytes) 0 flags [none] length: 392 10.0.1.1 > 10.0.2.2) ns3::TcpHeader (49153 > 50000 [ACK] Seq=2381 Ack=1 Win=32768 ns3::TcpOptionTS(16010;14009) ns3::TcpOptionEnd(EOL)) Payload (size=340)
r 17.0111 /NodeList/0/$ns3::Ipv4L3Protocol/Rx(1) ns3::Ipv4Header (tos 0x0 DSCP Default ECN Not-ECT ttl 64 id 11 protocol 6 offset (bytes) 0 flags [none] length: 392 10.0.1.1 > 10.0.2.2) ns3::TcpHeader (49153 > 50000 [ACK] Seq=2721 Ack=1 Win=32768 ns3::TcpOptionTS(16010;14009) ns3::TcpOptionEnd(EOL)) Payload (size=340)
t 17.0111 /NodeList/0/$ns3::Ipv4L3Protocol/Tx(2) ns3::Ipv4Header (tos 0x0 DSCP Default ECN Not-ECT ttl 63 id 11 protocol 6 offset (bytes) 0 flags [none] length: 392 10.0.1.1 > 10.0.2.2) ns3::TcpHeader (49153 > 50000 [ACK] Seq=2721 Ack=1 Win=32768 ns3::TcpOptionTS(16010;14009) ns3::TcpOptionEnd(EOL)) Payload (size=340)
r 17.2121 /NodeList/0/$ns3::Ipv4L3Protocol/Rx(1) ns3::Ipv4Header (tos 0x0 DSCP Default ECN Not-ECT ttl 64 id 12 protocol 6 offset (bytes) 0 flags [none] length: 392 10.0.1.1 > 10.0.2.2) ns3::TcpHeader (49153 > 50000 [ACK] Seq=3061 Ack=1 Win=32768 ns3::TcpOptionTS(16211;14211) ns3::TcpOptionEnd(EOL)) Payload (size=340)
t 17.2121 /NodeList/0/$ns3::Ipv4L3Protocol/Tx(2) ns3::Ipv4Header (tos 0x0 DSCP Default ECN Not-ECT ttl 63 id 12 protocol 6 offset (bytes) 0 flags [none] length: 392 10.0.1.1 > 10.0.2.2) ns3::TcpHeader (49153 > 50000 [ACK] Seq=3061 Ack=1 Win=32768 ns3::TcpOptionTS(16211;14211) ns3::TcpOptionEnd(EOL)) Payload (size=340)
r 17.2124 /NodeList/0/$ns3::Ipv4L3Protocol/Rx(1) ns3::Ipv4Header (tos 0x0 DSCP Default ECN Not-ECT ttl 64 id 13 protocol 6 offset (bytes) 0 flags [none] length: 392 10.0.1.1 > 10.0.2.2) ns3::TcpHeader (49153 > 50000 [ACK] Seq=3401 Ack=1 Win=32768 ns3::TcpOptionTS(16211;14211) ns3::TcpOptionEnd(EOL)) Payload (size=340)
t 17.2124 /NodeList/0/$ns3::Ipv4L3Protocol/Tx(2) ns3::Ipv4Header (tos 0x0 DSCP Default ECN Not-ECT ttl 63 id 13 protocol 6 offset (bytes) 0 flags [none] length: 392 10.0.1.1 > 10.0.2.2) ns3::TcpHeader (49153 > 50000 [ACK] Seq=3401 Ack=1 Win=32768 ns3::TcpOptionTS(16211;14211) ns3::TcpOptionEnd(EOL)) Payload (size=340)
r 18.0121 /NodeList/2/$ns3::Ipv4L3Protocol/Rx(1) ns3::Ipv4Header (tos 0x0 DSCP Default ECN Not-ECT ttl 63 id 9 protocol 6 offset (bytes) 0 flags [none] length: 392 10.0.1.1 > 10.0.2.2) ns3::TcpHeader (49153 > 50000 [ACK] Seq=2041 Ack=1 Win=32768 ns3::TcpOptionTS(16010;14009) ns3::TcpOptionEnd(EOL)) Payload (size=340)
r 18.0137 /NodeList/2/$ns3::Ipv4L3Protocol/Rx(1) ns3::Ipv4Header (tos 0x0 DSCP Default ECN Not-ECT ttl 63 id 10 protocol 6 offset (bytes) 0 flags [none] length: 392 10.0.1.1 > 10.0.2.2) ns3::TcpHeader (49153 > 50000 [ACK] Seq=2381 Ack=1 Win=32768 ns3::TcpOptionTS(16010;14009) ns3::TcpOptionEnd(EOL)) Payload (size=340)
t 18.0137 /NodeList/2/$ns3::Ipv4L3Protocol/Tx(1) ns3::Ipv4Header (tos 0x0 DSCP Default ECN Not-ECT ttl 64 id 7 protocol 6 offset (bytes) 0 flags [none] length: 52 10.0.2.2 > 10.0.1.1) ns3::TcpHeader (50000 > 49153 [ACK] Seq=1 Ack=2721 Win=32768 ns3::TcpOptionTS(18013;16010) ns3::TcpOptionEnd(EOL))
r 18.0152 /NodeList/2/$ns3::Ipv4L3Protocol/Rx(1) ns3::Ipv4Header (tos 0x0 DSCP Default ECN Not-ECT ttl 63 id 11 protocol 6 offset (bytes) 0 flags [none] length: 392 10.0.1.1 > 10.0.2.2) ns3::TcpHeader (49153 > 50000 [ACK] Seq=2721 Ack=1 Win=32768 ns3::TcpOptionTS(16010;14009) ns3::TcpOptionEnd(EOL)) Payload (size=340)
r 18.2137 /NodeList/2/$ns3::Ipv4L3Protocol/Rx(1) ns3::Ipv4Header (tos 0x0 DSCP Default ECN Not-ECT ttl 63 id 12 protocol 6 offset (bytes) 0 flags [none] length: 392 10.0.1.1 > 10.0.2.2) ns3::TcpHeader (49153 > 50000 [ACK] Seq=3061 Ack=1 Win=32768 ns3::TcpOptionTS(16211;14211) ns3::TcpOptionEnd(EOL)) Payload (size=340)
t 18.2137 /NodeList/2/$ns3::Ipv4L3Protocol/Tx(1) ns3::Ipv4Header (tos 0x0 DSCP Default ECN Not-ECT ttl 64 id 8 protocol 6 offset (bytes) 0 flags [none] length: 52 10.0.2.2 > 10.0.1.1) ns3::TcpHeader (50000 > 49153 [ACK] Seq=1 Ack=3401 Win=32768 ns3::TcpOptionTS(18213;16010) ns3::TcpOptionEnd(EOL))
r 18.2152 /NodeList/2/$ns3::Ipv4L3Protocol/Rx(1) ns3::Ipv4Header (tos 0x0 DSCP Default ECN Not-ECT ttl 63 id 13 protocol 6 offset (bytes) 0 flags [none] length: 392 10.0.1.1 > 10.0.2.2) ns3::TcpHeader (49153 > 50000 [ACK] Seq=3401 Ack=1 Win=32768 ns3::TcpOptionTS(16211;14211) ns3::TcpOptionEnd(EOL)) Payload (size=340)
t 18.4152 /NodeList/2/$ns3::Ipv4L3Protocol/Tx(1) ns3::Ipv4Header (tos 0x0 DSCP Default ECN Not-ECT ttl 64 id 9 protocol 6 offset (bytes) 0 flags [none] length: 52 10.0.2.2 > 10.0.1.1) ns3::TcpHeader (50000 > 49153 [ACK] Seq=1 Ack=3741 Win=32768 ns3::TcpOptionTS(18415;16211) ns3::TcpOptionEnd(EOL))
r 19.0139 /NodeList/0/$ns3::Ipv4L3Protocol/Rx(2) ns3::Ipv4Header (tos 0x0 DSCP Default ECN Not-ECT ttl 64 id 7 protocol 6 offset (bytes) 0 flags [none] length: 52 10.0.2.2 > 10.0.1.1) ns3::TcpHeader (50000 > 49153 [ACK] Seq=1 Ack=2721 Win=32768 ns3::TcpOptionTS(18013;16010) ns3::TcpOptionEnd(EOL))
t 19.0139 /NodeList/0/$ns3::Ipv4L3Protocol/Tx(1) ns3::Ipv4Header (tos 0x0 DSCP Default ECN Not-ECT ttl 63 id 7 protocol 6 offset (bytes) 0 flags [none] length: 52 10.0.2.2 > 10.0.1.1) ns3::TcpHeader (50000 > 49153 [ACK] Seq=1 Ack=2721 Win=32768 ns3::TcpOptionTS(18013;16010) ns3::TcpOptionEnd(EOL))
r 19.2139 /NodeList/0/$ns3::Ipv4L3Protocol/Rx(2) ns3::Ipv4Header (tos 0x0 DSCP Default ECN Not-ECT ttl 64 id 8 protocol 6 offset (bytes) 0 flags [none] length: 52 10.0.2.2 > 10.0.1.1) ns3::TcpHeader (50000 > 49153 [ACK] Seq=1 Ack=3401 Win=32768 ns3::TcpOptionTS(18213;16010) ns3::TcpOptionEnd(EOL))
t 19.2139 /NodeList/0/$ns3::Ipv4L3Protocol/Tx(1) ns3::Ipv4Header (tos 0x0 DSCP Default ECN Not-ECT ttl 63 id 8 protocol 6 offset (bytes) 0 flags [none] length: 52 10.0.2.2 > 10.0.1.1) ns3::TcpHeader (50000 > 49153 [ACK] Seq=1 Ack=3401 Win=32768 ns3::TcpOptionTS(18213;16010) ns3::TcpOptionEnd(EOL))
r 19.4155 /NodeList/0/$ns3::Ipv4L3Protocol/Rx(2) ns3::Ipv4Header (tos 0x0 DSCP Default ECN Not-ECT ttl 64 id 9 protocol 6 offset (bytes) 0 flags [none] length: 52 10.0.2.2 > 10.0.1.1) ns3::TcpHeader (50000 > 49153 [ACK] Seq=1 Ack=3741 Win=32768 ns3::TcpOptionTS(18415;16211) ns3::TcpOptionEnd(EOL))
t 19.4155 /NodeList/0/$ns3::Ipv4L3Protocol/Tx(1) ns3::Ipv4Header (tos 0x0 DSCP Default ECN Not-ECT ttl 63 id 9 protocol 6 offset (bytes) 0 flags [none] length: 52 10.0.2.2 > 10.0.1.1) ns3::TcpHeader (50000 > 49153 [ACK] Seq=1 Ack=3741 Win=32768 ns3::TcpOptionTS(18415;16211) ns3::TcpOptionEnd(EOL))
r 20.0139 /NodeList/1/$ns3::Ipv4L3Protocol/Rx(1) ns3::Ipv4Header (tos 0x0 DSCP Default ECN Not-ECT ttl 63 id 7 protocol 6 offset (bytes) 0 flags [none] length: 52 10.0.2.2 > 10.0.1.1) ns3::TcpHeader (50000 > 49153 [ACK] Seq=1 Ack=2721 Win=32768 ns3::TcpOptionTS(18013;16010) ns3::TcpOptionEnd(EOL))
t 20.0139 /NodeList/1/$ns3::Ipv4L3Protocol/Tx(1) ns3::Ipv4Header (tos 0x0 DSCP Default ECN Not-ECT ttl 64 id 14 protocol 6 offset (bytes) 0 flags [none] length: 392 10.0.1.1 > 10.0.2.2) ns3::TcpHeader (49153 > 50000 [ACK] Seq=3741 Ack=1 Win=32768 ns3::TcpOptionTS(20013;18013) ns3::TcpOptionEnd(EOL)) Payload (size=340)
t 20.0139 /NodeList/1/$ns3::Ipv4L3Protocol/Tx(1) ns3::Ipv4Header (tos 0x0 DSCP Default ECN Not-ECT ttl 64 id 15 protocol 6 offset (bytes) 0 flags [none] length: 392 10.0.1.1 > 10.0.2.2) ns3::TcpHeader (49153 > 50000 [ACK] Seq=4081 Ack=1 Win=32768 ns3::TcpOptionTS(20013;18013) ns3::TcpOptionEnd(EOL)) Payload (size=340)
t 20.0139 /NodeList/1/$ns3::Ipv4L3Protocol/Tx(1) ns3::Ipv4Header (tos 0x0 DSCP Default ECN Not-ECT ttl 64 id 16 protocol 6 offset (bytes) 0 flags [none] length: 392 10.0.1.1 > 10.0.2.2) ns3::TcpHeader (49153 > 50000 [ACK] Seq=4421 Ack=1 Win=32768 ns3::TcpOptionTS(20013;18013) ns3::TcpOptionEnd(EOL)) Payload (size=340)
